{
  "id": "2026-10-14-cnnchile-embalse-el-yeso",
  "medio_id": "cnnchile",
  "medio": "CNN Chile",
  "idioma": "es",
  "titulo": "Ejemplo ficticio: el embalse baja de su nivel habitual",
  "fecha": "2026-10-14",
  "url": "https://www.cnnchile.com/ejemplo/embalse-el-yeso",
  "area": "medio_ambiente",
  "resumen_propio": "palabra palabra palabra palabra palabra palabra palabra palabra palabra palabra palabra palabra palabra palabra palabra palabra palabra palabra palabra palabra palabra palabra palabra palabra palabra palabra palabra palabra palabra palabra palabra palabra palabra palabra palabra palabra palabra palabra palabra palabra palabra palabra palabra palabra palabra palabra palabra palabra palabra palabra palabra palabra palabra palabra palabra palabra palabra palabra palabra palabra palabra palabra palabra palabra palabra palabra palabra palabra palabra palabra palabra palabra palabra palabra palabra palabra palabra palabra palabra palabra palabra",
  "cifras": [
    {
      "valor": 220,
      "unidad": "millones de m3",
      "que_es": "capacidad del embalse (ejemplo ficticio)",
      "localizador": {
        "fuente": "noticia",
        "ubicacion": "párrafo 2"
      }
    },
    {
      "valor": "38 %",
      "unidad": "porcentaje",
      "que_es": "nivel actual del embalse (ejemplo ficticio)",
      "localizador": {
        "fuente": "noticia",
        "ubicacion": "gráfico 1"
      }
    }
  ],
  "recuperada_en": "2026-10-19T09:00:00Z",
  "filtro": {
    "version_rubrica": "4.0",
    "puntajes": {
      "genuino": 2,
      "decisiones": 2,
      "realismo": 2,
      "autenticidad": 2,
      "validacion": 1
    },
    "total": 9,
    "pasa": true,
    "justificacion": "Pregunta real abierta con cifras; validación con datos posteriores."
  }
}
